Project,Estimated Cost (USD),Notes
Mars Bridge,10000000000,Establishing a stable connection between Earth and Mars
Slingshot Mechanism,5000000000,Utilizing gravity assists and propulsion tech for efficiency
Philosophy Framework,500000,Developing a guiding philosophy to unify all projects
Building Pluto,15000000000,Creating sustainable infrastructure on Pluto or in its orbit
Artificial Planet 1 (Beacon),20000000000,Building a movable artificial planet as a beacon
Artificial Planet 2 (Seed),25000000000,Creating a self-sustaining habitat for long-term space habitation
